{
  "knowledge_version": "234dfffb4aee",
  "source_workbook": "Parthia Health - HF Knowledge Base.xlsx",
  "sheet": "Data dictionary",
  "notes": [],
  "rows": [
    {
      "element_id": "D001",
      "name": "Heart failure diagnosis",
      "category": "Profile",
      "definition": "Active diagnosis of heart failure",
      "data_type": "Coded",
      "unit": "n/a",
      "code_system": "SNOMED CT",
      "code": "84114007",
      "data_source": "EHR",
      "frequency": "When it changes",
      "valid_for_analysis": "Until changed",
      "priority": "MVP",
      "required_by_rules": "R01; R04; R05; R10",
      "used_by_agent": "All",
      "source_ids_text": "S01",
      "review_status_text": "In review",
      "notes": null,
      "source_ids": [
        "S01"
      ],
      "review_status": "in_review",
      "required_by_rule_ids": [
        "R01",
        "R04",
        "R05",
        "R10"
      ],
      "validity": null,
      "validity_has_context": false,
      "mvp": true
    },
    {
      "element_id": "D002",
      "name": "LVEF value and date",
      "category": "Profile",
      "definition": "Most recent left ventricular ejection fraction with measurement date",
      "data_type": "Number + date",
      "unit": "%",
      "code_system": "LOINC",
      "code": "10230-1",
      "data_source": "EHR / scan",
      "frequency": "When it changes",
      "valid_for_analysis": "12 months",
      "priority": "MVP",
      "required_by_rules": "R04",
      "used_by_agent": "Cardiology",
      "source_ids_text": "S01; S05",
      "review_status_text": "In review",
      "notes": "Drives HFrEF vs HFpEF",
      "source_ids": [
        "S01",
        "S05"
      ],
      "review_status": "in_review",
      "required_by_rule_ids": [
        "R04"
      ],
      "validity": {
        "amount": 12,
        "unit": "months"
      },
      "validity_has_context": false,
      "mvp": true
    },
    {
      "element_id": "D003",
      "name": "HF phenotype",
      "category": "Profile",
      "definition": "HFrEF or HFpEF, derived from LVEF using U.S. definitions",
      "data_type": "Category",
      "unit": "n/a",
      "code_system": "Internal",
      "code": "n/a",
      "data_source": "Calculated",
      "frequency": "When LVEF changes",
      "valid_for_analysis": "Until LVEF changes",
      "priority": "MVP",
      "required_by_rules": "R02; R03; R04",
      "used_by_agent": "All",
      "source_ids_text": "S01; S05",
      "review_status_text": "In review",
      "notes": "U.S. and ESC thresholds differ",
      "source_ids": [
        "S01",
        "S05"
      ],
      "review_status": "in_review",
      "required_by_rule_ids": [
        "R02",
        "R03",
        "R04"
      ],
      "validity": null,
      "validity_has_context": false,
      "mvp": true
    },
    {
      "element_id": "D004",
      "name": "Comorbidities",
      "category": "Profile",
      "definition": "CKD, diabetes, atrial fibrillation, hypertension, depression, cognitive impairment, COPD",
      "data_type": "Coded list",
      "unit": "n/a",
      "code_system": "SNOMED / ICD-10",
      "code": "Per condition",
      "data_source": "EHR",
      "frequency": "When it changes",
      "valid_for_analysis": "Until changed",
      "priority": "MVP",
      "required_by_rules": "R10",
      "used_by_agent": "All",
      "source_ids_text": "S01; S04",
      "review_status_text": "In review",
      "notes": null,
      "source_ids": [
        "S01",
        "S04"
      ],
      "review_status": "in_review",
      "required_by_rule_ids": [
        "R10"
      ],
      "validity": null,
      "validity_has_context": false,
      "mvp": true
    },
    {
      "element_id": "D005",
      "name": "Medication list",
      "category": "Medications",
      "definition": "All active medicines incl. OTC and supplements: name, dose, frequency, start/change/stop dates, prescriber",
      "data_type": "Coded list",
      "unit": "n/a",
      "code_system": "RxNorm",
      "code": "Per drug",
      "data_source": "EHR / scan",
      "frequency": "Every change",
      "valid_for_analysis": "Current list only",
      "priority": "MVP",
      "required_by_rules": "All medication rules",
      "used_by_agent": "Pharmacist",
      "source_ids_text": "S01; S09",
      "review_status_text": "In review",
      "notes": "Patient must confirm",
      "source_ids": [
        "S01",
        "S09"
      ],
      "review_status": "in_review",
      "required_by_rule_ids": [],
      "validity": null,
      "validity_has_context": false,
      "mvp": true
    },
    {
      "element_id": "D006",
      "name": "Missed doses and reason",
      "category": "Adherence",
      "definition": "Missed doses in past 7 days and main reason",
      "data_type": "Number + category",
      "unit": "doses",
      "code_system": "Internal",
      "code": "n/a",
      "data_source": "Patient",
      "frequency": "Weekly",
      "valid_for_analysis": "7 days",
      "priority": "MVP",
      "required_by_rules": null,
      "used_by_agent": "Behavioral health",
      "source_ids_text": "S01",
      "review_status_text": "In review",
      "notes": "Reasons: cost, side effects, forgot, diuretic timing",
      "source_ids": [
        "S01"
      ],
      "review_status": "in_review",
      "required_by_rule_ids": [],
      "validity": {
        "amount": 7,
        "unit": "days"
      },
      "validity_has_context": false,
      "mvp": true
    },
    {
      "element_id": "D007",
      "name": "Potassium",
      "category": "Labs",
      "definition": "Serum potassium with result date",
      "data_type": "Number + date",
      "unit": "mEq/L",
      "code_system": "LOINC",
      "code": "2823-3",
      "data_source": "EHR / scan",
      "frequency": "Each result",
      "valid_for_analysis": "90 days; 14 days after MRA/RAAS start or dose change",
      "priority": "MVP",
      "required_by_rules": "R02; R07",
      "used_by_agent": "Pharmacist",
      "source_ids_text": "S01",
      "review_status_text": "In review",
      "notes": null,
      "source_ids": [
        "S01"
      ],
      "review_status": "in_review",
      "required_by_rule_ids": [
        "R02",
        "R07"
      ],
      "validity": {
        "amount": 90,
        "unit": "days"
      },
      "validity_has_context": true,
      "mvp": true
    },
    {
      "element_id": "D008",
      "name": "Sodium",
      "category": "Labs",
      "definition": "Serum sodium with result date",
      "data_type": "Number + date",
      "unit": "mEq/L",
      "code_system": "LOINC",
      "code": "2951-2",
      "data_source": "EHR / scan",
      "frequency": "Each result",
      "valid_for_analysis": "90 days",
      "priority": "MVP",
      "required_by_rules": null,
      "used_by_agent": "Pharmacist",
      "source_ids_text": "S01",
      "review_status_text": "In review",
      "notes": null,
      "source_ids": [
        "S01"
      ],
      "review_status": "in_review",
      "required_by_rule_ids": [],
      "validity": {
        "amount": 90,
        "unit": "days"
      },
      "validity_has_context": false,
      "mvp": true
    },
    {
      "element_id": "D009",
      "name": "Creatinine / eGFR",
      "category": "Labs",
      "definition": "Serum creatinine and eGFR with result date",
      "data_type": "Number + date",
      "unit": "mg/dL; mL/min/1.73m²",
      "code_system": "LOINC",
      "code": "2160-0; 98979-8",
      "data_source": "EHR / scan",
      "frequency": "Each result",
      "valid_for_analysis": "90 days; 14 days after MRA/RAAS start or dose change",
      "priority": "MVP",
      "required_by_rules": "R03",
      "used_by_agent": "Pharmacist",
      "source_ids_text": "S01; S04",
      "review_status_text": "In review",
      "notes": null,
      "source_ids": [
        "S01",
        "S04"
      ],
      "review_status": "in_review",
      "required_by_rule_ids": [
        "R03"
      ],
      "validity": {
        "amount": 90,
        "unit": "days"
      },
      "validity_has_context": true,
      "mvp": true
    },
    {
      "element_id": "D010",
      "name": "BNP or NT-proBNP",
      "category": "Labs",
      "definition": "Natriuretic peptide with result date",
      "data_type": "Number + date",
      "unit": "pg/mL",
      "code_system": "LOINC",
      "code": "30934-4; 33762-6",
      "data_source": "EHR / scan",
      "frequency": "Each result",
      "valid_for_analysis": "12 months",
      "priority": "MVP",
      "required_by_rules": null,
      "used_by_agent": "Cardiology",
      "source_ids_text": "S01",
      "review_status_text": "In review",
      "notes": null,
      "source_ids": [
        "S01"
      ],
      "review_status": "in_review",
      "required_by_rule_ids": [],
      "validity": {
        "amount": 12,
        "unit": "months"
      },
      "validity_has_context": false,
      "mvp": true
    },
    {
      "element_id": "D011",
      "name": "Body weight",
      "category": "Home monitoring",
      "definition": "Morning weight, daily",
      "data_type": "Number + date",
      "unit": "kg",
      "code_system": "LOINC",
      "code": "29463-7",
      "data_source": "Device / patient",
      "frequency": "Daily",
      "valid_for_analysis": "2 days",
      "priority": "MVP",
      "required_by_rules": "R08",
      "used_by_agent": "Cardiology",
      "source_ids_text": "S01; S12",
      "review_status_text": "In review",
      "notes": "Most important home signal",
      "source_ids": [
        "S01",
        "S12"
      ],
      "review_status": "in_review",
      "required_by_rule_ids": [
        "R08"
      ],
      "validity": {
        "amount": 2,
        "unit": "days"
      },
      "validity_has_context": false,
      "mvp": true
    },
    {
      "element_id": "D012",
      "name": "Blood pressure",
      "category": "Home monitoring",
      "definition": "Systolic and diastolic home readings",
      "data_type": "Number + time",